{
  "verdict": "PASS",
  "summary": "README.md changes only lines 36 and 38 as planned: the Maven/mvnw/pom.xml references are replaced by the Gradle 9.8.0 wrapper and build.gradle (Java 25 Temurin toolchain), which matches the stack, gradle-wrapper.properties and build.gradle. All acceptance criteria and invariants hold. No other file was modified outside the agent state files.",
  "issues": [],
  "next_action": "NONE"
}
